DLSxcoJNlxg,"Freedom, she is a representation of the young people wanting to be free in this world. She is the spirit of Freedom. I dreamed and you also. ✨️✨️✨️",My soul is touched,"Только тот, кому снился такой сон, поймёт это чувство 💔",Thank you for making my dream come true.,"i believe this is what my mom is doing right now in heaven,, last may was her 57th birthday, but God wanted her to be forever 55 years old.. Rest in love my dear Mother.. until we meet again❤️ from your forever little boy.","I always see myself flying in my dreams. I used to wish so deeply to have such a power — to be able to fly. This video really touched me. After watching it closely, I closed my eyes and found myself inside the music, inside the video — it felt like I was truly flying.","Все жизнь мне снятся такие сны😍 Не знаю, что они значат, но это мое любимое кино 🥹",حُلمي الدائم نومًا ويقظةً 🤎,"Самое большое удручающее обстоятельство в жизни, что эволюция не дала возможности людям летать.",Man Tushimda Xuddi shunaqa uchaman😍😂,Finally good IA videos,That 3 am dreams be like🌝,"Igual meu sonhos indo no banheiro, quando acordo tá um monte de água igual tá aí 🥲",Best ai video 😍✨,I'm in my dreams 😂 exactly,Literal mis sueños,⁨شبیه خوابم بود 🥺🤍⁩,One of the Best AI Videos,"Já vivi isso muitas vezes , nos meus sonhos foi tão real❤️",,Así me imagino que es la muerte. O la vida de los libres.,اريد,"I posted this incredible video on my story today, and a lot of people said they thought it was me… i watched it a hundred times, as if i were her… thank u for making things like that",This is like: Dreams come true,Tushlarimda xuddi shunaqa uchaman😍,the pov of Wendy going to Neverland,What a time to be alive. This footage is incredible! Very impressive work. Mind-blowing 🤯,Всегда мечтала посмотреть свои вот такие летающие сны в видеозаписи😍,Мои сны в 80%,Why can't i fly like this too😭😭🔥🔥,Sometimes AI is sweet✨🤍,Мечта 😍,this is good,Это же мой сон🥹🙏🏼🫶🏼,One of the best-made AI art pieces I've ever seen on Instagram.,"Я так умела летать когда то, только не помню когда",please could you tell me what AI is this? And how hard is make video of this quality?,мои сны..,how i imagine her,My dreams 🙌✨🤍,My Dream🥹✨,Had dreams like thisn😍,,شب که می‌شود:,We dream of walking over water because Jesus Christ did it first 🙌🔥,🥹✨,Can sharks jump out?,The blaze - dreamer,😍,Que sensação boa!!!,,,,,,,,,,,,,,,,,,,,,,,,,,,,,,,,,,,,,,,,,,,,,,,,,,,,,,,,,,,,,,,,,,,,,,,,,,,,,,,,,,,,,,,,,,,,,,,,,,,,,,,,,,,,,,,,,,,,,,,,,,,,
DEglt6Xy4zZ,Amazing 🙌,❤️❤️,😍😍😍😍,Lindo!❤️,@stevenmrankin ❤️,Nice scene ❤️,"She rejected him. Might be nature beautiful, but not her nature.",Incredible 🔥,❤️,😮😮😮🔥,Wow lily ❤️,😍❤️,Sangar🔥,❤️❤️,❤️❤️❤️,😍,❤️❤️,❤️,❤️❤️❤️❤️❤️❤️,🔥🔥🔥,,😮😍,Unmatched beauty,Wow 😍😍,🌸🏵️🤍,❤️,Love this atmosphere 🌙💫,❤️,Wow amazing 🔥🔥,We need to protect nature. Support local wildlife charities anything helps,❤️😍😍,Nice,😍😍😍,❤️,Wow 😍,Magnifique 👏,Wow ❤️,Wow!!😍🔥👏,Beautiful,😍😍😍,😢,Как прекрасно,Amazing 👏👏👏👏,❤️,Simply breathtaking 😍,❤️😍,Beautiful 😍,😍,Wow 😍,Fantastica,,,,,,,,,,,,,,,,,,,,,,,,,,,,,,,,,,,,,,,,,,,,,,,,,,,,,,,,,,,,,,,,,,,,,,,,,,,,,,,,,,,,,,,,,,,,,,,,,,,,,,,,,,,,,,,,,,,,,,,,,,,,
CikP68Ej7du,🔥,Breathtaking peace 😍,Divine view ❤️,🔥🔥,Feeling like paradise 😍✨✨,Such a beautiful looking creation.,I love the music 🔥,❤️,"Great job artist, I want to be as good some day",Wow😮😍,😍 dramatic,,Uwais Al Qarane Dhikr is the solution to all your problems. It is the healing for your soul and your body. It draws you closer to Allah with love. Uwais Al Qarane Dhikr is a divine favor and a precious treasure from Allah to His servants. Follow @loveofuwaysi The best dhikr is Uwais Al Qarane Dhikr www.veyselkarane.com,"This is an invitation, a residue rather than a picture. Yes I'll stay for a while",Nice one,Nice 🔥🔥❤️,🙌,🔥🔥,Some paths don't reveal where they lead... only that you are meant to climb. The light remembers you. ✨,Bridge to heaven 🔥,Night heaven 💖,It has a peacefulness that reminds me of a Monet painting.,So goood,We are selecting 7 artists for a filmed residency. You’d be strong. Apply on our profile. 💥💥,(.),Thats what I would call home 💫,Amaizing motion picture! Great digital artcraft!,Take me now please,😍😍😍😍😍,😍🔥👏,😮😮😮nice,You can’t Fathom what it really looks like 🙏🏾,👏,Ikstra ordinire,Yes where my loved ones are who I am missing terribly and crying over two three days straight it hurts ❤️❤️❤️,https://hoter.co/A/106420pgw,https://hoter.co/A/106420pgw,😮😮,@b_the_gaaz,i wanna run up there one day.❤️,Avino Jaacobs stege till himmelen der Hashem er!,😇🙏🏽❤️😢🔥,Amen I love you jesus and God ❤️🙌❤️🙌,🙌,❤️🙌👏,AMEN PADRE CELESTIAL AMEN AMEN AMEN AMEN AMEN AMEN AMEN AMEN,"This is so beautiful, Amen, can't wait for that day, I'm so anxious and excited to be with my Lord and God I am ready when he comes",😂😂,I want to go home,@maydns_,,,,,,,,,,,,,,,,,,,,,,,,,,,,,,,,,,,,,,,,,,,,,,,,,,,,,,,,,,,,,,,,,,,,,,,,,,,,,,,,,,,,,,,,,,,,,,,,,,,,,,,,,,,,,,,,,,,,,,,,,,,,
C3oeAHmu5gB,can I draw this?🥹😏,. . . Merit - Mérito,😍😍😍😍🌟🌟🌟🌟◻️◻️◻️❤️🎈🌹,That blue is so beautiful ✨💙🩵,Gorgeous,Se parece a mis sueños 💙,🔥 Looks Amazon,Anya,Amazing ❤️ Wonderful,Imagine just sitting here and sipping a glass of wine and unwinding the life❤️🔥,❤️👏,Me encanta ❤️,I love light houses and the ocean,❤️❤️,Its my dream,It's giving hilda🥹,magical,Gorgeous!,Красиво,So beautiful ❤️,😍😍😍,❤️,This looks like the Portland head light,😍😍,🙌❤️,😍😍😍😍😍,🔥🔥,😍🙌❤️❤️❤️,@guilojujuy,Epic😍,@blue_moon_226,❤️😍,So dreamy,😍😍😍😍,This is gorgeous! Be still my heart! 💙,Allí en ese cielo brilla José Luis todas las noches ❤️ esperando justicia y así será,This is SOOOOO beautiful!!! ❤️,"I wish there were longer clips, could watch them for ages",😍😍😍,Amazing 😍,😍,,,,,,,,,,,,,,,,,,,,,,,,,,,,,,,,,,,,,,,,,,,,,,,,,,,,,,,,,,,,,,,,,,,,,,,,,,,,,,,,,,,,,,,,,,,,,,,,,,,,,,,,,,,,,,,,,,,,,,,,,,,,,,,,,,,,,
DOtnkYcCt1X,"Set them free, let them rise, and reach for the stars they've always dreamed of. They deserve to shine brighter... 🕊️🤍",Пусть будут крылья всегда 🪽- небо найдется 🤍🤍🤍,"One step of hope, a thousand steps of courage 🥹🪽","was just sitting here thinking about how hard we all work for our kids. Sometimes we feel exhausted, but then we look at their sleeping faces and it’s all worth it. ❤️ I just posted a deep 'Mother’s Prayer' on my profile for anyone who needs a little extra strength today. It’s a reminder that you are doing an amazing job, Mama. 🕊️✨ Feel free to stop by my page if you need a daily dose of peace. We’re in this together! 🤱""",🕊️🤍🕊️🤍🕊️🤍🕊️🤍🕊️,💕🦋,😍,Perhaps freedom can only be taken away...❤️❤️❤️dearest Farsan the sun shines for all... the moon shines for all let the wind lift us... I love your work always refreshing and uplifting ❤️❤️❤️❤️,🤍🕊️🕊️😍,ایران🇮🇷🇮🇷🇮🇷🇮🇷🇮🇷🇮🇷,☀️🕊️✨🤍🙏🏼🤍✨🦅💫,🧚🏻‍♀️,😍😍😍😍,😍😍,This speaks to me,A MI ……..MARTINA,❤️❤️❤️❤️,😢😢😢,👏👏,👼 ❤️❤️,🕊️,I thought this is like how parents acting like wings for their child to grow,🕊️,"May no one find me , not even in my silence 🕊️",🔥,🔥🔥🖤🖤,😢😢😢🕊️🕊️🕊️🕊️,You can fly just trust your self,"How much I loved it. It gave me a sense of release, freedom, and eternal peace. 😢😍",❤️,Bin bereit zu gehn....🙌😓,❤️❤️,🎈🎈🫶🫶,❤️,🙌❤️,❤️🙌🔥👏😢🙌,❤️,Mashallah 💝.,One day I’m gonna fly away…🪽,wow.... 🔥 🔥 👑 👑 👑 ⚡ ⚡ ⚡ ✨ ✨ ✨ 🧿 🧿 🧿 🦁 🦁 🦁 💎 💎 💎 💯 💯 💯 🚀 🚀 🚀 💣 💣 💣 🌪️ 🌪️ 🌪️ 🦾 🦾 🦾 🌟 🌟 🌟 🎯 🎯 🎯 🧨 🧨 🧨 🛸 🛸 🛸 🎸 🎸 🎸 🔱 🔱 🔱 💠 💠 💠 🐲 🐲 🐲 🌌 🌌 🌌 🏆 🏆 🏆 🏎️ 🏎️ 🏎️ 🧊 🧊 🧊 💀 💀 💀 🦍 🦍 🦍 🌋 🌋 🌋 ⚔️ ⚔️ ⚔️ 🚩 🚩 🚩 🦅 🦅 🦅 🛸 🛸 🛸 🩸 🩸 🩸 🌀 🌀 🌀 🦾 🦾 🦾 👑 👑 👑 💎 💎 💎 ⚡ ⚡ ⚡ 🔥 🔥 🔥 🌪️ 🌪️ 🌪️ 🧿 🧿 🧿 🦁 🦁 🦁 🚀 🚀 🚀 💯 💯 💯 🔱 🔱 🔱 💠 💠 💠 🐲 🐲 🐲 🌋 🌋 🌋 🦍 🦍 🦍 💀 💀 💀 🎸 🎸 🎸 🌟 🌟 🌟 🎯 🎯 🎯 🦾 🦾 🦾 🧨 🧨 🧨 🛸 🛸 🛸 🚩 🚩 🚩 🦅 🦅 🦅 💎 💎 💎 ✨ ✨ ✨ 👑 👑 👑 🔥 🔥 🔥,♥️🪽,🙂🥲,😍😍😍,😍,🖤🪽,👏👏😍,🔥🔥🔥🙌,🔥🔥🔥,🔥😍,🙌,,,,,,,,,,,,,,,,,,,,,,,,,,,,,,,,,,,,,,,,,,,,,,,,,,,,,,,,,,,,,,,,,,,,,,,,,,,,,,,,,,,,,,,,,,,,,,,,,,,,,,,,,,,,,,,,,,,,,,,,,,,,
DRSGIcZEQRC,❤️❤️ Amazing 👌✨️😍✨️,Brilliant work dear💙🔥,Awesome work Victoria 😮,😍😍😍😍,💙💙,😍😍😍,❤️❤️💙🙌🙌🙌🙌😍😍😍😍,😍🔥😍🔥😍🔥🙌,🔥🔥🔥🔥🔥😍😮 bravo!!!,Beautiful work 👏👏👏,"Pure magic, Viktoria! Your talent is incredible! Bravo 👏👏👏❤️❤️❤️🔥🔥🔥💙💙💙",Beautiful 😍,👏👏👏,Wonderful!😍😍💙💙💙💙💙,❤️😍❤️ great,❤️🙌,🔥🔥🔥🔥,All works are so impressive 🔥🔥🔥,Incredible 👏👏👏,WOW that's awesome 💙,Super 😍😍😍,Amazing 🔥👏👏👏,😍😍,😮👏👏👏Gorgeous work,💞💞🌹❤️🌹💞💞🌹🌹❤️,Wow🔥🔥🔥😍👏👏👏,Woah this is incredible 😍😍😍😍,😍😍😍😍😍,Great work! 👏🏼👏🏼👏🏼👏🏼,Beautiful 🖤🖤🖤,Love it❤️,💙💙💙✨,Your ability to tell stories through visuals is truly incredible 💙,Blended nicely,💙💙💙💙💙🤍🤍🤍🤍🤍,😍😍😍😍,Nice 🔥🔥🔥,Fantastic Viktoria 💙 👁️ 💙,Stupendo 🤩 👏👏👏,🔥🔥love it🔥🔥🔥,Absolutely stunning!! 😍,,🔥Very interesting work!!! 😍😍😍,Amazingly done 🔥🩶💙🩶,Wonderful work 👏😍😍😍,"Ух, потрясающе👏🔥😍",🔥🔥,Beautiful 💙💙💙,Waouh 🤍💙,😍😍,,,,,,,,,,,,,,,,,,,,,,,,,,,,,,,,,,,,,,,,,,,,,,,,,,,,,,,,,,,,,,,,,,,,,,,,,,,,,,,,,,,,,,,,,,,,,,,,,,,,,,,,,,,,,,,,,,,,,,,,,,,,
CqW9uyIsXFJ,@charly.medina.92505 mira,0 because it’s not art,"Amazing, izin save 😍",❤️❤️,❤️🔥,😍,10❤️,1000.. ❤️❤️❤️❤️❤️🔥🔥🔥👏🙌😍 🇮🇩🌹🇲🇨,😮😮😮,Awww😍😍😍,Chota bheem ek episode hai usma bhe asa he billa hai,😍10,😍😍,amazing Art 🎨,😍 Wow,If any tool is able to generate anything it doesn't mean that @orionaimagazine is an artist..... Now this feature page is no more authentic and feeling happy to unfollow it🤮🤮🤮🤮🤮,Out of 10 🔥,🔥,10 no doubt,👏👏👏,Can you share text prompt,Play ‏▶︎ •၊၊||၊|။||||။၊|။|||။|||။၊| 0:37,Amazing work!😍😍,🔥💛💙,10/10 rating 🔥👏,awesome,F***ing awesome,😍😍😍...,Masterpiece🔥,Artist 🔥,1000000/10 🔥,10,,,,,,,,,,,,,,,,,,,,,,,,,,,,,,,,,,,,,,,,,,,,,,,,,,,,,,,,,,,,,,,,,,,,,,,,,,,,,,,,,,,,,,,,,,,,,,,,,,,,,,,,,,,,,,,,,,,,,,,,,,,,,,,,,,,,,,,,,,,,,,
DTCBCWEEWGC,😍,🥰❤👍🙏❤🥰,💞💞,❤️ukochaną piosenka dla ukochanej osoby ❤️🔥,😮👏😍,🔥❤️🔥❤️🔥❤️🔥❤️🤍❤️🤍❤️🤍,❤️❤️❤️❤️❤️❤️❤️❤️❤️❤️❤️❤️❤️❤️❤️❤️,,❤️😍,🙌💛✨️💝💛💝✨️💛🙌,😍😍😍😍,❤️❤️😍😍,😍😍,😍😍😍😍❤️,❤️❤️,😍,❤️,Que hermoso momento 🙏🙏🙏❤️❤️,👏👏👏👏👏😍,Bonito💙,😍,😍❤️👏👏❤️,Het was een mooie dag 💝🎊❤️,❤️❤️❤️❤️🔥🔥🔥🔥,Amore mio❤️❤️❤️🔥🔥🔥,😍😍,Perfeito 😍😍😍😍💎💫,❤️❤️,❤️,💜🖤🥰😘🙏👍👍🙏😘🥰💜💜🖤🖤🖤,😍❤️🔥,😍,Guuuaaaoooo 👏,❤️Bonito🔥Belo❤️😍,❤️Amor este és lo mio maior sueno Solamente contigo El para ty pós Soy tuya mujer mi amor bonitooo💞💃🕺💞,Que bella boda que lo. defruen,❤️❤️🔥🔥For ever jLove You❤️❤️,Pretty. 😍,😍😍😍,Счастье счастье любовь😍,"Вы , люблю вас ❤️❤️❤️❤️❤️❤️",Bello 🙌❤️❤️❤️,"I love this song and I want to spend the rest of my Life with my sweet gentleman tender, I want everything of you. Isaiah",❤️❤️ así affata hablo affata❤️❤️❤️,👏👏😍😍,Прости меня пожалуйста,🔥❤️,😍😍👏👏👏,❤️❤️❤️,❤️😍😍,,,,,,,,,,,,,,,,,,,,,,,,,,,,,,,,,,,,,,,,,,,,,,,,,,,,,,,,,,,,,,,,,,,,,,,,,,,,,,,,,,,,,,,,,,,,,,,,,,,,,,,,,,,,,,,,,,,,,,,,,,,,
DT2lgb4k5Qe,❤️🫶🤘🤘🤘,アナモルフィックレンズの様なハレーションが入ると更に美しくなりそうです👏,これですね😍💖めちゃくちゃ綺麗☺️🦋💫すーさんは光と影の表現が本当にお上手です👏💕💕,Stunningly beautiful 😍😍🔥🔥❤️❤️,Stunning 🔥❤️,😍😍😍😍😍😍,"Wow, it's so beautiful! ❤️😍🤩😍🥰🥰😘😘🥰",👏😍,🖤🌹🤗🌹🖤,❤️❤️,😍😍😍😍👏👏👏🔥🔥🔥❤️❤️❤️❤️❤️,Beautiful ❤️❤️❤️❤️❤️❤️,🖤😢,TOP 🦋🌹,❤️大丈夫だよ👌ねつ🙆,🙏🏻🙏🏻🙏🏻🙏🏻🌹🖤🌹🙏🏻🙏🏻🙏🏻🙏🏻,Delicate 🦋,Beauty!,❤️❤️❤️❤️❤️❤️❤️❤️❤️❤️,(‎˶°0°‎˶)ｵｵｫｫ❤️❤️❤️✨,☺️🥰😘❤️🌹💫🌹❤️😘🥰☺️,Prompt dm,🔥👏😍,❤️❤️😍😍😍like the tats🔥,❤️❤️❤️,Pretty,❤️❤️❤️,❤️❤️👏👏,Nice 🦋💙🥰,可愛いくて綺麗❤💐💐💐💐,😍😍😍🔥🔥,🔥🔥,🔥🔥❤️😍,❤️❤️❤️❤️,🔥🔥🔥🔥,❤️❤️❤️,💖💖💖,青蝶々🦋大好き💙,,夜のしじまに何を想うか 一人の女💕朝の来ない夜は無いのに🌉,また欲しくなる様なアート！😍　バッグからの灯りで人物が際立ちますね　そしてショートヘヤー顔も素敵に映ってますね👍,Hermoso corte de cabello te ves mucho más no en y naturalmente hermosa 😍😅🤍✨😍🌹❤️🩵🇲🇽,Tu belleza es delicada y gracil como las alas de una mariposa,La nuit nous révèle une pure merveille ❤️❤️❤️,🤗💜🌹💖こんばんは ˚˖𓍢ִ໋🌷͙֒✧🩷˚.🎀༘⋆,２枚目は、🌹薔薇のタトゥーも入ってるね👍🥰💕,いいね👍🥰💕メッチャ綺麗だね🦋蝶が舞ってるね👍🥰💕この娘の表情も、月明かりに照らされて、いい感じだね🥰,❤️❤️❤️❤️❤️💕💕💕😘😘😘🌹,,,🫶🌸🤍🌸🤍🌸🙌,Wonderful 🔥,😍,😍😍クールビューティー✨とっても好きな系です!✨ボブもいいですね🥰✨🦋✨💙💙💙,🔥👏🔥absolutely perfect 👏🏻👏🏻👏🏻👏🏻 the detail is crazy 🔥🔥🔥,❤️😍🙌👏🔥🔥🔥🔥,👏👏👏,🥰🥰🥰🥰,Belleza ❤️😍,⠀⠀⠀⠀⠀⠀⣴⠶⢦⣤⠶⠶⣄⠀⠀⠀⠀ ⠀⠀⠀⠀⠀⠀⣇⠀♥️⠀⢀⣿⠀⠀⠀⠀ ⠀⠀⠀⠀⠀⠀⠙⢧⣄⠀⣠⠞⠁⠀⠀⠀⠀ ⠀⠀⠀⠀⠀⣀⡀⠀⠉⠛⠃⣠⣄⡀⠀⠀⠀ ⠀⠀⠀⠀⡞⠉⠙⢳⣄⢀⡾⠁⠈⣿⠀⠀⠀ ⠀⠀⠀⠀⢻⡄⠀⠀⠙⢿⡇⠀⢰⠇⠀⠀⠀ ⠀⠀⠀⠀⠀⠙⣦⡀⠀⠀⠹⣦⡟⠀⠀⠀⠀ ⠀⠀⠀⠀⠀⠀⠈⢳⣄⠀⠀⠈⠻⣄⠀⠀⠀ ⠀⠀⠀⠀⠀⠀⡞⠋⠛⢧⡀⠀⠀⠘⢷⡀⠀ ⠀⠀⠀⢠⡴⠾⣧⡀⠀⠀⠹⣦⠀⠀⠈⢿⡄ ⠀⠀⣀⣿⠀⠀⠈⠻⣄⠀⠀⠀⠀⠀⠀⠈⣷ ⢠⡟⠉⠛⢷⣄⠀⠀⠈⠀⠀⠀⠀⠀⠀⣰⠏ ⠀⢷⡀⠀⠀⠉⠃⠀⠀⠀⠀⠀⠀⠀⣴⠏⠀ ⠀⠈⠻⣦⡀⠀⠀⠀⠀⠀⠀⢀⣠⠞⠁⠀⠀ ⠀⠀⠀⠈⠙⠶⣤⣤⣤⡤⠶⠋⠁⠀⠀⠀⠀,,,,,,,,,,,,,,,,,,,,,,,,,,,,,,,,,,,,,,,,,,,,,,,,,,,,,,,,,,,,,,,,,,,,,,,,,,,,,,,,,,,,,,,,,,,,,,,,,,,,,,,,,,,,,,,,,,
DUlMAD2lRix,👏👏,🤍🖤,🔥🔥🔥,🖤🖤🖤,🔥🔥,😍😍😍😍,❤️❤️❤️❤️❤️,❤️❤️❤️🔥,😍,So cool. Loving it. 😍😍😍😍🔥🔥🔥🔥,Great!!😍👏👏👏👏,Cute 🥰 Love seeing Wednesday in your style 🖤,Waaaaaaw Beautiful 👏,Wow amazing beautiful 😍🖤,,Beyond Belief GORGEOUS ❤️❤️❤️❤️❤️,"Even if it's not the right day, it's always a joy to see Wednesday haha 😁 So many different versions and they're all spectacular as always, my friend 🫠😌🖤",😍🤌🏻,"1,2,4,6,7 are more wensday",,,,,,,,,,,,,,,,,,,,,,,,,,,,,,,,,,,,,,,,,,,,,,,,,,,,,,,,,,,,,,,,,,,,,,,,,,,,,,,,,,,,,,,,,,,,,,,,,,,,,,,,,,,,,,,,,,,,,,,,,,,,,,,,,,,,,,,,,,,,,,,,,,,,,,,,,,,
DTv9sJGjD7-,"¡Guau, es muy, muy bonito!😍😍😍😍😍",wonderful work ❤️🙌,Breathtaking piece! So wonderfully done👏👏👏❤️❤️❤️😍😍😍🌹🌹🌹⚘️⚘️⚘️,Muy lindos los retratos. !!! Los haces tú,Очень красиво 👏👏👏👏👏❤️❤️❤️❤️❤️🌹🌹🌹🌹🌹,Amazing work Gabriella ✨✨✨,Gorgeous 👏😍❤️🔥,♥️🤍Beautiful 🤍♥️🔥❤️🔥❤️🔥❤️🔥❤️🔥🔥🔥🔥,Fantastic work so beautiful 😍😍😍😍😍👏👏👏🔥🔥🔥🙌❤️❤️❤️❤️,"Incredible creation, I really like it ✨🤩😎",Amazing work my friend ❤️❤️❤️✨,Amazing beauty❤️❤️❤️❤️,Splendid 😍😍😍,Che bella gente! 😍,beautiful🔥,Gorgeous portraits ❤️,🤩🤩🤩🤩🤩,Beautiful ❤️🔥❤️,So beautiful pic ❤️😍,Nice Work❤️❤️👏👏👏,❤️❤️❤️❤️,magnificent creation I love your works they are great 👏🏻😊😎,😍😍😍😍👏👏👏,"Bold, bloody, and beautiful. 🩸",So beautiful ❤️❤️❤️❤️,Beautiful ❤️😍,❤️😍😍😍😍👏👏👏❤️❤️❤️🔥🔥,Amazing 😍,,😍😍👌,👏👏👏,😍😍😍😘😘🌹,🔥,❤️❤️❤️😍😍😍😍❤️❤️❤️,🔥😍,😍😍😍,😍😍,😍😍😍😍,🔥🔥🔥🔥🔥🔥🔥🔥🔥🔥🔥🔥🔥🔥🔥🔥🔥,👑,Amazing 🔥🔥👏👏👏😍,Stunninnggg😍😍😍😍😍❤️❤️❤️❤️,Beautiful set❤️❤️🙌,🙇‍♂️👋🙋‍♂️🫡,Wonderful set 😍😍😍❤️❤️❤️,❤️😍👏,👏,🔥🔥🔥,❤️❤️❤️,😍😍😍,Timeless beauty ✨😍,Stunning!!!🔥🔥🔥🔥😍😍😍,❤️❤️❤️❤️❤️👏👏👏👏,❤️🔥😍,I love all your beauties ❤️,🔥🔥🔥🔥🔥,Great!!😍😍👏👏👏,,,,,,,,,,,,,,,,,,,,,,,,,,,,,,,,,,,,,,,,,,,,,,,,,,,,,,,,,,,,,,,,,,,,,,,,,,,,,,,,,,,,,,,,,,,,,,,,,,,,,,,,,,,,,,,,,,,,,
DR2OG7qEjMb,🔥🔥🔥🔥🔥🔥🔥🔥,❤️❤️❤️,😮,🔥🔥🔥🔥,So amazingly crafted ❤️🙌,💯💯💯🫂🫂🫂🙏🏻🫀🫀🫀🫂🫂🫂🫂💯💯💯💯👾👾👾👾👾🫂🫂🫂🌔🌔🌔🌔🌔🫂🫂🫂🤶🏻🤶🏻🤶🏻🫂🫂🫂🙆🏻‍♀️🙆🏻‍♀️🙆🏻‍♀️🫂🫂🫂🫂🫂🫀🫀🫀🫂🫂🫂🫂🔪🔪🔪🔪,The panther🔥🙌🙌🙌🙌,🔥🔥🔥,ثور 💀,👏👏👏👏👏,Gold,❤️,Blue neon,🔥,Black Panther always looks so cold,How bout both 💫💫💫,5' 🌟,,,,,,,,,,,,,,,,,,,,,,,,,,,,,,,,,,,,,,,,,,,,,,,,,,,,,,,,,,,,,,,,,,,,,,,,,,,,,,,,,,,,,,,,,,,,,,,,,,,,,,,,,,,,,,,,,,,,,,,,,,,,,,,,,,,,,,,,,,,,,,,,,,,,,,,,,,,,,
DSLEWPjkgrL,😍😍😍,Ficou top,Perfect,❤️🙌,🔥🔥🔥🔥,Mashallah,If this is the new cast in total watching it🙌😍😍😍,Hogwarts Legacy is free ok Epic Games now btw🙌,#skill,"Loki being Snape and Thor being Draco Malfoy is actually hilarious, now I wonder who's in control of one another now 😂",Snap and Loki one was the top,Tom Hiddleston standalone Snape series,What if Tom Holland was Harry Potter?,Cool Potter ✌️,@hoodrich.ai for cool Ai🔥🔥🔥🔥🔥🔥🔥🔥,The music is so calming,😮,Hogwarts avengers,Zendaya no please 😓,They look more like harry potter characters than the series does,,Thanks mate 🔥🔥,Not bad,tom holland should be harry potter not robert downey jr,Not zendaya,Delete this. Darn AI,,,,,,,,,,,,,,,,,,,,,,,,,,,,,,,,,,,,,,,,,,,,,,,,,,,,,,,,,,,,,,,,,,,,,,,,,,,,,,,,,,,,,,,,,,,,,,,,,,,,,,,,,,,,,,,,,,,,,,,,,,,,,,,,,,,,,,,,,,,,,,,,,,,,
DR2Y8p9giTt,Atemberaubende Welten❤️❤️❤️,❤️🙌,😍😍😍,👏,😍😍,😍😍😍😍,🙌🔥🙌,😍😍😍Excellent🔥🔥🔥,That’s truly amazing 😍,❤️‍🔥❤️‍🔥❤️‍🔥💘,👏👏👏👏👏👏👏😍,🔥🙌🔥,Incredible work🔥🔥🔥,🔥🔥🔥,Predivno!👏👏👏👏👏❤️❤️❤️❤️❤️❤️❤️🔥🔥🔥🔥🔥🔥🔥🔥🔥🔥🔥🔥🔥🔥🔥🔥⚔️⚔️⚔️⚔️⚔️⚔️⚔️⚔️🛡️🛡️🛡️🛡️🛡️🛡️🛡️🛡️🛡️,🙌,Oh these riders of Rohan look so amazing!! ❤️❤️ fantastic work!! 🔥🔥,Bravo!! 👏👏,Ah so epic and powerful!💯🎯🔥🔥🔥💪,Awesome 🔥🔥🔥,❤️ 😮👏👏👏👏,Fantastic looking 🔥👏,I absolutely love your stunning creations! 😍👏🔥,Amazing 🔥🔥,Wonderful 😮😮😍😍👏👏,🔥🔥🔥,Sublime ❤️,Amazing 😍🔥,doesnt get old,This is absolutely incredible💙💙,Stunning bro🔥,,Ас салям алейкум,😡,🤯,Que bien 👏,🛡️⚔️⚔️,,😍,,,,,,,,,,,,,,,,,,,,,,,,,,,,,,,,,,,,,,,,,,,,,,,,,,,,,,,,,,,,,,,,,,,,,,,,,,,,,,,,,,,,,,,,,,,,,,,,,,,,,,,,,,,,,,,,,,,,,,,,,,,,,,,,,,,,,,,
DMV_EO1N3qS,👏👏👏,🙌🙌🙌🙌🔥,😍😍😍😍,😮😮😮😍😍😍,🧡,😍👏👏👏👏,😮,✨👋,❤️,👏👏😍,🔥👏,Adına Nazar diyelim bence güzel bir anlatım,Amazing work❤️❤️❤️❤️❤️,🔥,Bello 🔥🔥🔥,Beautiful !!,Wow what an artist,@palomapoeta 09:01,A mindfu*k then?! 🤭🤫😁,Mükemmel 🔥🔥🔥,👏👏,,,,,,,,,,,,,,,,,,,,,,,,,,,,,,,,,,,,,,,,,,,,,,,,,,,,,,,,,,,,,,,,,,,,,,,,,,,,,,,,,,,,,,,,,,,,,,,,,,,,,,,,,,,,,,,,,,,,,,,,,,,,,,,,,,,,,,,,,,,,,,,,,,,,,,,,,
DQGSvs-DDyl,😍❤️,❤️,😍👏👏,❤️,@cemadrian 🙌,Amazing aiart send please 😍,Beklerken kök saldım demek eylemini anlatan bi görsel gibi... Oldukça köklü ve sabırlı 🪾,Amazing work 😍Can.u #share it on #👉@the_art._ocean,,,,,,,,,,,,,,,,,,,,,,,,,,,,,,,,,,,,,,,,,,,,,,,,,,,,,,,,,,,,,,,,,,,,,,,,,,,,,,,,,,,,,,,,,,,,,,,,,,,,,,,,,,,,,,,,,,,,,,,,,,,,,,,,,,,,,,,,,,,,,,,,,,,,,,,,,,,,,,,,,,,,,,
