Post ID (DO NOT EDIT COL),1,2,3,4,5,6,7,8,9,10,11,12,13,14,15,16,17,18,19,20,21,22,23,24,25,26,27,28,29,30,31,32,33,34,35,36,37,38,39,40,41,42,43,44,45,46,47,48,49,50,51,,,,,,,,,,,,,,,,,,,,,,,,,,,,,,,,,,,,,,,,,,,,,,,,,,,,,,,,,,,,,,,,,,,,,,,,,,,,,,,,,,,,,,,,,,,,,,,,,,,,,,,,,,,,,,,,,,,,,,,,,,,
C-44eycs1H5,So beautiful ❣️,Such a relaxing atmosphere. I love to be alone with this majestic view.,It's so soothing 😍😍😍,🔥❤️,😍😍❤️❤️,😍😍😍😍😍🤍💕,❤️❤️❤️❤️❤️,Happy Thursday!😍,"This looks so calm and peaceful, but let's be real—if I sat by a pond like this, mosquitoes would ruin the vibe in two seconds flat.",Beautiful artwork 😍,Love it 🤩,❤️💕🤍💚💗,❤️❤️,❤️,🙄😎,😊😊😊,💕,💚💚💚,Your style is unmatched ! 🫶,😍👏,😮😍,🔥🔥🔥,😍😍😍😍😍😍😍😍😍,So Lovely 😍❤️,❤️❤️❤️❤️❤️❤️,👏👌🏻,❤️❤️❤️❤️💚,💗,😍,👍👍👍👍,😍😍😍😍😍,❤️❤️❤️,🤍✨🤍,😍😍😍,😍😍😍😍,💗💕💗💕💗💕💗💕💗💕💗,These pictures gave me so much peach 💚,😍😍,You soul will be peace and pleasant in your life. 😍😍😍,😩,Literally made my jaw drop,She is my imaginary girl 🙂‍↔️,Please provide me some prompts for this type of images.,💕💕,How it can be full frame,❤️❤️❤️❤️❤️❤️❤️,Healing💕,💕💕💕,This is peace 💚,🤍🤍🤍,,,,,,,,,,,,,,,,,,,,,,,,,,,,,,,,,,,,,,,,,,,,,,,,,,,,,,,,,,,,,,,,,,,,,,,,,,,,,,,,,,,,,,,,,,,,,,,,,,,,,,,,,,,,,,,,,,,,,,,,,,,,
DVMb9kqElDz,Simply outstanding 🔥🔥🔥,🔥😍🔥😍😍🔥😍👏,Out standind❤️,🔥🙌,🔥🔥🔥,"These are stunning images,  dear Katie💞💙💜💙💞",Absolutely incredible 🔥🔥,👍👍👍👍,Gorgeous! What’s Niji?👏👏👏💟💫,Incredible 😮😍🔥,❤️🌹❤️,🔥😍😍😍,❤️❤️❤️,😍😍😍😍😍😍😍❤️❤️❤️😮😮😮,Absofuckenlutely love it !,Wow I'd love to have these as my phone wallpaper 🔥🙌,I love these🔥🔥🔥🔥,Top,😍😍😍😍😍,❤️❤️❤️❤️❤️,❤️,✨✨✨💜✨✨✨,👏👏👏🔥🔥🔥❤️❤️ Awesomeness!!! Love them!! 😍,"Wow, these are pretty cool mate🔥🙌",My soul reaper Waiting for u,🔥🔥🔥🔥🔥🌀👑🌀☯️♾️⚛️⭐☀️💫🌙💥💥💥💥💥,Absolutely fantastic such artistry I salute you......,🔥🔥🔥🔥🔥🔥,👏👏👏👏👏👏,Wow that's great dear 😍😍😍,🔥🔥🔥🔥🔥🔥🔥,🔥👏🔥🙌💜💜💜✌️🌊🌠,🔥🔥🔥🔥,Amazing work 💯 your art style is unique and ideas are beyond words ⭐,Absoluty beautiful 😍🔥🔥😍,Incredible set🔥🔥🔥,👍👍👍👏👏,Woahhhh!! Breathtaking 😍,Incredible work 🔥🔥🔥,😍😍😍,Stunning artworks🔥🔥🔥🔥🔥🔥,Magical work🔥🔥🔥,Wooow 🔥🔥🔥 marvelous,Absolutly awesome work Katie. So very powerful.💜,😍😍🔥,Very beautiful 😍,Incredible 😮😮😮😮,Wowww fantastic!!!!😍😍😍😍😍😍,I really like those moons amd scythes😍🔥🔥,Yet another testament to your extraordinary vision.”✨✨,,,,,,,,,,,,,,,,,,,,,,,,,,,,,,,,,,,,,,,,,,,,,,,,,,,,,,,,,,,,,,,,,,,,,,,,,,,,,,,,,,,,,,,,,,,,,,,,,,,,,,,,,,,,,,,,,,,,,,,,,,,,
DNSWhv1uGjZ,"Oh darling, say👏it👏louder👏. Your vibe and art are clearly powerful - which some people just can’t handle.  YOU’RE AMAZING! SO IS YOUR ART! Big hugs 💖💜💖💜💖💜💖","Yes please, beautiful soul! 💖 Always community over competition. We’re each so uniquely made—meant to be cherished, not threatened. And I’ve actually listened to Lunchbox Friends so many times when I’ve felt the sting of unkindness too 🥰💖 Your energy and art are such a gift♥️ sending love always ✨",Preaching the truth💖💖💖,Powerful words under beautiful pieces. I’m glad you’re here and I’m sorry that’s been your experience recently.,So true!!! Thank you for your words 💫 Lets shine together 💎,Beautiful said and couldn't agree more💖💖💖💖💖,"Awww I could tell you were a sweetheart, I think you’re great and I love your work! 💖💖💖","So well said mandee for real🫂🙌❤️...you talented you creative & you friendly , I'm glad I'm not the only one that noticed this toxic narcissist ego trip some of them...and you not alone we support you and see you 🔥🙌❤️",☺️🩷,It’s nice to see real talk 💖 and well said ❤️‍🔥✨,Looking at beautiful pictures lifts my spirits 😆❤️❤️❤️,My lord. This is stunning 💖💖💖,👏🏾👏🏾👏🏾,Keep up the amazing work!! Love ya and will be a supporter of yours til the end 🩷🔪,"You come out with amazing art creations consistently, and that makes people hate out of jealousy! No le hagas caso a las amargadas pendejas envidiosas! Tu energia cuesta mas que ellas!❤️‍🔥✨️Eres unica - Amo todas tus magnificas creaciones! YOU ARE A MAGICAL FORCE OF LIGHT✨️🌟💖",Yes!! You are 🔥 don’t let anyone extinguish your light! Keep burning bright my sweetness!💕,❤️❤️❤️🔥🔥,Real talk 🔥🔥🔥 keep shinning and doing you,Beautifully said girlfriend. Did i mention the art? 😍. Your authenticity is your freedom girly. I love this,Yeah Youre right 👏🙌💖💖,Bringing a microphone.. louder for those in the back! Well said 💖💖💖💖👏👏,👏👏👏👏,"🖤 you're a Phenomenal talented woman inside & out & if they can't see that then they're missing out on all the greatness that's within yuh Queen 💅🏽 I'm glad I came across your page, yuh match my aura & inner & outer aesthetic & I'm here to stay as a loyal follower darling 💋","There’s plenty space for all of us because there’s a whole universe inside of everyone, creativity is infinite and I think every single person has million of ideas to explore 👏",Gorgeous,,,,,,,,,,,,,,,,,,,,,,,,,,Beautiful!!,,,,,,,,,,,,,,,,,,,,,,,,,,,,,,,,,,,,,,,,,,,,,,,,,,,,,,,,,,,,,,,,,,,,,,,,,,,,,,,,,,,,,,,,,,,,,,,,,,,,,,,,,,,,,,,,,,,,,,,,,,,
DMyBan2tx-f,❤️❤️❤️,❤️❤️😍,"If I ever see a telephone booth again, I’ll feel exactly like this inside 🙌",😍😍,✨💫,😍😍😍,🌺❤️💗🍁💐🌹,❤️❤️,Your work is incrdible 😍😍,❤️🔥❤️,💖💖💖,👏👏👏👏,"You have lovely, wonderful and eye-capturing creations.",😍😍😍😍,❤️,🔥🔥🔥,So beautiful ❤️,🩷🩷💚💚🩵🩵,Incredible 😍😍😍,I really like the idea! Do you mind if I take inspiration from your work?❤️,By AI or real paint by human?,Your phone booth is so cute!,❤️🙃🥰🙃🥰♥️,So beautiful 😍😍👏,,,,,,,,,,,,,,,,,,,,,,,,,,,,,,,,,,,,,,,,,,,,,,,,,,,,,,,,,,,,,,,,,,,,,,,,,,,,,,,,,,,,,,,,,,,,,,,,,,,,,,,,,,,,,,,,,,,,,,,,,,,,,,,,,,,,,,,,,,,,,,,,,,,,,,
DHOa6Ajt1dq,Adore this job 😍 sea horse so beautiful 💫,Wow beautiful,Very cool!,Hermoso 💚,❤️❤️❤️,🔥🔥🔥🔥,😍😍😍😍😍😍😍,Very beautiful ❤️❤️❤️,This is great 🙌❤️🙏🏼,😍😍😍🔥🔥🔥🔥🔥🔥🔥🔥🔥😮,I want that,😍😮😮😮😮😮😍😍😍😍😍😍,Que hermoso ❤️❤️❤️❤️,Can you make this clip a tad longer with the song? Gorgeous!,Need more shrimps 🦐,😍😍😍😍😍😍😍😍😍😍❤️❤️❤️❤️❤️❤️❤️❤️❤️,Hermoso,So beautiful 😍❤️,😍😍😍😍😍😍🔥🔥🔥🙌🙌,This is so creative😍😍,❤️❤️❤️❤️❤️🔥🔥🔥🔥🔥🔥🔥😢😢😢😢😢,Gorgeous,I want more sea animals 😂,The light reflecting is a galaxy of colours. 🌌,👏👏👏👏👏,❤️❤️❤️❤️❤️❤️,sea horse DIAMOND🔥,🔥🔥🔥🔥🔥👏👏👏👏👏👏,🔥,Ok Beautiful Crystals 🔥🔥🔥Always a crowd pleaser 🔥🔥🔥,TWINKLE TWINKLE  DIAMOND’S LIGHT’,😍🔥,😮😮😮😮,❤️❤️❤️❤️❤️😍😍😍😍😍😍,😍😍😍😍😍😍😍😍😍,👏👏👏,I love sea horses,😍😍😍,🔥🔥🔥,Oh wow it’s so beautiful that Christal seahorse😍😍😍,❤️❤️❤️❤️❤️❤️❤️❤️❤️,🖤💛❤️🌹,😍,😍😍❤️😍❤️😍❤️😍❤️😍😍,❤️❤️,❤️,This is absolutely stunning! The detail and sparkle are incredible. What AI tool did you use to create this? ✨,🔥🔥🔥🔥❤️,This is such an impressive piece! The details and the way the light reflects off the crystals make it feel alive. I'd love to learn more about your process. Counting down the days until I can see more from your collection!,❤️❤️❤️❤️,,,,,,,,,,,,,,,,,,,,,,,,,,,,,,,,,,,,,,,,,,,,,,,,,,,,,,,,,,,,,,,,,,,,,,,,,,,,,,,,,,,,,,,,,,,,,,,,,,,,,,,,,,,,,,,,,,,,,,,,,,,,
C0sQkLEPkyC,That's why the kids have to be in bed! 😮👏👏,🤣😂🤣🙈🎅🏽🎄💀,🌲⭐️,This is metal 🤘,Yesss bro this is it,I think 2 sleighs 🤘,❤️❤️❤️,Damnnnn these are so cool haha will love to ride on those badass sleigh 😂😍🙌,These are incredible,Is this what santa rides when he's delivering coal to satan in hell?,🔥,Love it 🔥🔥,,,,,,,,,,,,,,,,,,,,,,,,,,,,,,,,,,,,,,,,,,,,,,,,,,,,,,,,,,,,,,,,,,,,,,,,,,,,,,,,,,,,,,,,,,,,,,,,,,,,,,,,,,,,,,,,,,,,,,,,,,,,,,,,,,,,,,,,,,,,,,,,,,,,,,,,,,,,,,,,,,
DQcyILfj1Nx,🤍🤍🌟🙌🖤,👏👏👏👏,🔥🔥🔥,👏👏,🔥🖤🤍🖤,This is super cool work as always 😍😍,😍😍😍,😍😍😍😍,Looove this 🔥🔥🔥,🙌👏👏👏👏👏👏👏👏,Love this! The light spots in pic 2 add such a warm glow 😍,🤍🤍💥,🖤👏🔥,"Classic wheels in these visual scenes, shakes as sculpture in the snow 🔥",🔥🔥🔥🔥🔥,Love this,I prefer them to be tirelessly wrapped as well… much better than crowding the roads...,😍👏👏,,,,,,,,,,,,,,,,,,,,,,,,,,,,,,,,,,,,,,,,,,,,,,,,,,,,,,,,,,,,,,,,,,,,,,,,,,,,,,,,,,,,,,,,,,,,,,,,,,,,,,,,,,,,,,,,,,,,,,,,,,,,,,,,,,,,,,,,,,,,,,,,,,,,,,,,,,,,
DQhcx5VDMHT,😮,😍😍😍,❤️❤️❤️,😍😍,👏❤️🔥,😍😍😍😍😍,"Oh, that is a happy soul! 😊",❤️,🔥🔥,The smile is soo contagious !!!❤️❤️❤️,So uplifting 😍😍😍,Oh she's lovely,Ooooh trop chou 👏❤️,👏👏,Lovely piece,😍😍😍😍👏👏👏,Happy! This made me smile. 😊❤️,🔥,Stunning.  Is this digital?,So beautiful ❤️❤️❤️,Watercolor dreams in red,❤️❤️👏👏👏❤️❤️,Beautiful work ❤️❤️❤️,👏👏👏,👏👏👏👏👏😍🩷🩷🩷,"Wow, this is absolutely stunning! 😍✨",So lovely and lively! Beautiful art! 👏🏻👏🏻👏🏻♥️♥️,Gorgeous,😍❤️❤️👏👏,😍💕🥰❤️,❤️❤️,❤️❤️❤️❤️,🔥🔥👏👏❤️❤️,Totally amazing!!!😍😍😍👏👏,😍🔥🔥❤️❤️❤️,Love the energy! 🔥 🔥 🔥,🧡🩷,😍❤️😍❤️😍❤️❤️,🧡🩷💛,👏👏🔥❤️,😍,😍😍😍👏👏,Incredibly awesome work ❤️❤️❤️❤️😍😍😍👏🔥🔥,Gorgeous ❤️❤️,👉💯💯💯👈,❤️‍🔥😎❤️‍🔥,,,,,,,,,,,,,,,,,,,,,,,,,,,,,,,,,,,,,,,,,,,,,,,,,,,,,,,,,,,,,,,,,,,,,,,,,,,,,,,,,,,,,,,,,,,,,,,,,,,,,,,,,,,,,,,,,,,,,,,,,,,,,,,,
DVYkAyEDF9p,😍😍😍,👏😍😍😍,"This is truly a magical work—it doesn’t just capture the eye, but touches the heart 💘 You’ve created a dream where feelings can be felt and soulful heal 🫶 Thank you for making and sharing this with us ✨ Absolutely gorgeous ☀️",😍😍👏👏❤️❤️❤️,Gorgeous!,,,,,,,,,,,,,,,,,,,,,,,,,,,,,,,,,,,,,,,,,,,,,,,,,,,,,,,,,,,,,,,,,,,,,,,,,,,,,,,,,,,,,,,,,,,,,,,,,,,,,,,,,,,,,,,,,,,,,,,,,,,,,,,,,,,,,,,,,,,,,,,,,,,,,,,,,,,,,,,,,,,,,,,,,
Co-OeX8tLU-,🔥,"Great work🔥, I love the shapes and colors😍",Wow great concept and design,Crazy good! Keep it up 👏,Wonderful 🔥,How did you do it? 😯,,,,,,,,,,,,,,,,,,,,,,,,,,,,,,,,,,,,,,,,,,,,,,,,,,,,,,,,,,,,,,,,,,,,,,,,,,,,,,,,,,,,,,,,,,,,,,,,,,,,,,,,,,,,,,,,,,,,,,,,,,,,,,,,,,,,,,,,,,,,,,,,,,,,,,,,,,,,,,,,,,,,,,,,
DS46sWajEKe,La obra de arte de Dios es el cielo y la naturaleza sin duda alguna 😍❤️,Wow 🔥🔥🔥😍,😍😍😍,,"O extraordinário é tão longe, e tão perto ao mesmo tempo ❤️‍🔥",O sonho da minha vida morar literalmente no meio do mato🥹😍❤️❤️,Que belleza total xd😍❤️,,,😮 yes men,🥹🫠😻,😍,😍😍,Vinland Vibes 😭🌟,Peaceeeeeee🖤,❤️,❤️😍,,اريد العيش هنا😭😣,,👏👏,😍😍😍😍👏👏👏😍😍😍,😍,Lindíssimo 🌈🌈🌈🌈🌈🏠🏠🏠,😍,😍😍😍😍👏👏👏,🧡😍,😍😍😍,👏👏👏,❤️🙌❤️,Amo a música e a vibe 😍,😍,Nossa 🥹,😢😍😍hermoso,❤️,😍😍,❤️😍🔥,❤️❤️❤️,🌄🖤,🙌😍,🌒😍,😍😍,هذه الدنيا كيف الجنه ؟! 😍,عادي اخذهم ؟,😍😍😍😍😍,😍,मेरा सपना था कि मैं इस तरह की जगह पर बस जाऊं😢❤️❤️😍,How do you upload such large images? How does the image size get so big?,😍,😍😍😍,,,,,,,,,,,,,,,,,,,,,,,,,,,,,,,,,,,,,,,,,,,,,,,,,,,,,,,,,,,,,,,,,,,,,,,,,,,,,,,,,,,,,,,,,,,,,,,,,,,,,,,,,,,,,,,,,,,,,,,,,,,,
DT5TuKfjWvD,👏😍,3rd image ❤️,so sad,😢,"While I see a distraught penguin, I can't help but applaud (and envy) the courage to make the (tough) call. One might say it's giving up, while it could also be coming to terms with the situations! So much to interpret, so little to infer.",The second one is besttt,Too good boss!! 🥹,😢😢😢esob valo lage na,Send me this post 💝✨,#spchowdhuryphotography #anatarctica #penguinz0 #depressed #pingu #anarcticadventure #kolkata_lanes #kolkataphotography #cinematicphotography #cinematiclook #cinelook #200mm #16mm #16mmfilm #wildlifephotography #wildlifeplanet #aiartwork #aiartcomm #aiphotographer #aiphotoedit #aiphotoediting #aiartistcommunity,"The Japanese macaque meme taught me this penguin's story, and it made me very sad and helpless, just like global warming is unstoppable. I couldn't imagine how I could have helped it if I had wanted to. It also reminded me of many BBC documentaries where multiple photographers, watching groups of penguins, wept, thinking about how their species would disappear in a few decades. I wanted to accompany that penguin, to walk with it into the Antarctic interior, to see what it was searching for. I was heartbroken, but there was nothing I could do.",Send me this post ✨💖,,,,,,,,,,,,,,,,,,,,,,,,,,,,,,,,,,,,,,,,,,,,,,,,,,,,,,,,,,,,,,,,,,,,,,,,,,,,,,,,,,,,,,,,,,,,,,,,,,,,,,,,,,,,,,,,,,,,,,,,,,,,,,,,,,,,,,,,,,,,,,,,,,,,,,,,,,,,,,,,,,
DPZX0snCLqL,👏👏👏😍😍,🤩 Fantastic! ✨ Love the light(s)!!!!,😍👏,These are absolutely beautiful my dear Annette stunningly stunningly beautiful and christmasy too. ❤️❤️❤️❤️,So cute 🔥🔥🧡,Stuunninngggg😍😍😍😍😍😍😍,Gorgeous😍😍😍,Perfect!! ❤️,So stunning ❤️❤️❤️,so gorgeous ❤️👏,So beautiful 🤎❤️🧡💛,😮😍😮😍👏😍👏😍❤️😍❤️😍,❤️❤️❤️Bellissimo,cozy! 🤍🤗🍁🍂,Wonderful work my dear ❤️❤️❤️,So beautiful😍🍁😍🍁✨,😍😍😍👏,😍😍 Charming 🧡,AMAZING 😍😍😍,Simply Magnificent !😍👏🍁✨🍂,So cute ❤️❤️,So beautiful!! ❤️❤️❤️,So beautiful! ☺️,Golden hour beauty 😍😍😍 bravo!!!,😍😍😍😍😍😍😍,Lovely 🔥🔥🙌😍,Very beautiful 😍😍😍,I love these! They're all so pretty!,Truly captivating🍁🍂❤️💛🧡🍂🍁,🔥🔥🔥,"✨ohhhhh I love when you go glittery, Ann!!! I love the inspiration image and yours are SO beautiful too!!! 😍😍😍",Precious 💕💖,🔥❤️🔥,Really beautiful 🔥🔥🔥🔥😍😍,Oh! It's magical ✨️😍,absolutely stunning I love your works so much👏🏻😍✨,So beautiful 😍,Magnifique😍😍😍😍😍,So schön und magisch💛👏👏,Truly beautiful and so adorable. Wonderful autumn vibes. 🥰🍂🍁🍂💯,✨️😍so schön❤️✨️,"Ich finde diese Arbeit einfach traumhaft, so schöne Farben, tolles Lächeln… wünderschön ❤️❤️❤️",Love the warmth and autumn vibe 🍁,Sehr hübsch ❤️✨🍁,Beautiful 😍,👏👏👏,Simply beautiful and uplifting.,Woooow 🔥🔥🔥😍,,,,,,,,,,,,,,,,,,,,,,,,,,,,,,,,,,,,,,,,,,,,,,,,,,,,,,,,,,,,,,,,,,,,,,,,,,,,,,,,,,,,,,,,,,,,,,,,,,,,,,,,,,,,,,,,,,,,,,,,,,,,,,
DVD1_XvCDTi,,😢😍😍😍,Great 😍🔥,Awesome,😍,🔥🔥😍,😍😍😍,😍😍😍😍,❤️,😍😍😍😍,😍😍,❤️,Cute ❤️,😍😍❤️,❤️😍❤️😍❤️😍😍,Walle❤️😍😍,Cutee😍😍😍😍,Sweety ❤️,Amazing 😍,❤️🥰💫,❤️❤️,❤️❤️😍😍,Gorgeous ❤️❤️❤️,Great ❤️❤️❤️,So cute😍😍😍,So lovely set 👏😍,Can I have photo number 4? Can you send it to me?,❤️❤️❤️,Wall E 😍😍,💝💝💝,❤️❤️❤️❤️❤️,😍,❤️,🔥,❤️❤️❤️😍😍😍,😊🤍❤️,Hermoso,Absolutely love wall-e!!!!!!😍❤️ beautiful done,Absolutely Gorgeous ❤️,Awww😍😍😍😍,Love Walle-e with beautiful flowers on his head. 💛💛♻️💐💐,❤️Sweet sweet Walle E❤️😍,🙌🙌🙌 Snd this picture @the._art.factory 🍁,❤️❤️❤️❤️❤️❤️❤️,😍😍😍😍😍😍😍,❤️❤️❤️❤️❤️❤️❤️,,,,,,,,,,,,,,,,,,,,,,,,,,,,,,,,,,,,,,,,,,,,,,,,,,,,,,,,,,,,,,,,,,,,,,,,,,,,,,,,,,,,,,,,,,,,,,,,,,,,,,,,,,,,,,,,,,,,,,,,,,,,,,,,
DLGLX5bIe9Q,🔥🔥🔥,Aw I can’t believe I’m just now seeing these! They came out great!,Beautiful ❤️❤️❤️❤️❤️,Beautifull 💚💚💚💚💚,🔥🔥,This gives so much dopamine to look at. I love pink,Love how the cat change alongside the styling! ❤️,Nice! 🔥❤️❤️❤️,🩷🩷🩷,Mood: locked in. Eyes: definitely still here 👀,,,,,,,,,,,,,,,,,,,,,,,,,,,,,,,,,,,,,,,,,,,,,,,,,,,,,,,,,,,,,,,,,,,,,,,,,,,,,,,,,,,,,,,,,,,,,,,,,,,,,,,,,,,,,,,,,,,,,,,,,,,,,,,,,,,,,,,,,,,,,,,,,,,,,,,,,,,,,,,,,,,,
DU2oB0uCOGt,🔥🔥🔥,Amazing 🔥🔥🔥,,"Magnifique, je suis admirative devant de créativité 👏👏🔥🔥",WOW!!🔥 Really Magnificent set!🔥🔥🐴🌹🔥🔥 Well done!!!🔥🔥👏🏻👏🏻👏🏻👏🏻👏🏻,"Wow, amazing 🔥🔥🖤🖤😍😍",Beautiful work ❤️❤️❤️❤️❤️,❤️❤️❤️❤️,😍😍beautiful,Wonderful 🔥,So beautiful 💙💙✨️,Absolutely stunning my friend ❤️❤️🔥❤️❤️👏,Very beautiful😍😍😍😍😍,Awesome 🔥😍🔥😍,🔥🔥🔥,Amazing work 👍👌👏🔥🔥🔥😍❤️,Beautiful work 😍😍👏🔥👏❤️❤️,Just amazing as always Charlize! ❤️‍🔥❤️‍🔥❤️‍🔥❤️‍🔥❤️‍🔥,Very beautiful 😍🔥🔥🔥,Gorgeous 🔥🔥🔥🔥,"Incredibly gorgeous work, darling 👏👏👏👏❤️❤️❤️🔥🔥🔥🐎🐎🐎🌸🌸🌸",🔥🔥🔥 Fire horse year ❤️‍🔥❤️‍🔥❤️‍🔥,,Fantastic work 😍🔥❤️😍,❤️❤️❤️❤️,"Wow, absolutely fantastic work ❤️‍🔥 ✨ ❤️‍🔥 ✨ ❤️‍🔥",Happy New Year!! ❤️❤️🔥🔥❤️❤️,❤️,👏👏👏🔥🔥🔥🔥👏🔥🔥,❤️❤️❤️,gorgeous ❤️❤️,Love❤️❤️❤️❤️❤️❤️,><><><><Ateş Atı Yılı<><><><> ?¿?¿?¿Miladi Takvim Yılı?¿?¿?¿ ======== 2026 ======== ====İKİBİNYİRMİALTI===== 2=İKİ 0=BİN 2=YİRMİ 6=ALTI,,,,,,,,,,,,,,,,,,,,,,,,,,,,,,,,,,,,,,,,,,,,,,,,,,,,,,,,,,,,,,,,,,,,,,,,,,,,,,,,,,,,,,,,,,,,,,,,,,,,,,,,,,,,,,,,,,,,,,,,,,,,,,,,,,,,,,,,,,,,,
DKYASe8Ivyo,超綺麗😍♥️💕,❤️,Fabulous ❤️❤️❤️❤️❤️,😍😍❤️❤️,❤️,😍😍,Breathtaking 😍😍😍,So beautiful and magical ❤️❤️❤️😍😍😍,❤️❤️beautiful,😍😍😍😍🩷🩷🩷🩵🩵🩵,😍Amazing ❤️❤️👏👏👏,Beautiful 💙💜🩷,gorgeous 😍,😍😍😍,✨💞✨,Gorgeous 😍🔥😍,"Wow, that's amazing! ❤️‍🔥❤️‍🔥❤️‍🔥",😍😍😍😍,😍🔥,,,,,,,,,,,,,,,,,,,,,,,,,,,,,,,,,,,,,,,,,,,,,,,,,,,,,,,,,,,,,,,,,,,,,,,,,,,,,,,,,,,,,,,,,,,,,,,,,,,,,,,,,,,,,,,,,,,,,,,,,,,,,,,,,,,,,,,,,,,,,,,,,,,,,,,,,,,
DRPrkoRDOoZ,Phenomenal Set Bro 🔥 love the 3rd one❤️,👏🙌❤️😍 great work bro,I would totally Wear that suite 😍,So awesome friend!! Love these so much 🔥🔥🔥🔥🔥😍,Perfect 👏,Sleek 🔥🔥,Que lindo 😍,Stunning my friend 🖤🥰🖤💯♥️,Awsomee dudee🔥🔥,😍😍,Wowww stunning!!!😍😍😍👏👏👏,"Nice job, beautiful lighting ❤️",Örümcek adam 😮😍❤️,Very dope 👏👏,Very cool concept. Well done! ✌️🎉,"Woww honey, this looks perfect😍👏",Very deteiled 😍,,😍❤️😍❤️😍❤️,🔥🔥🔥,🔥🔥🔥🔥,😍😍😍😍,🔥🔥🔥,😍😍😍,❤️❤️❤️❤️,😍😍😍,🔥🔥🔥,👏👏,👏👏👏,🙌🙌🙌❤️,Awesome work 🔥🔥,Nice my friend ❤️❤️❤️🙌👏,❤️🙌,👏Wow 🤩 Can you #send #me this #work 👐🏻,,,,,,,,,,,,,,,,,,,,,,,,,,,,,,,,,,,,,,,,,,,,,,,,,,,,,,,,,,,,,,,,,,,,,,,,,,,,,,,,,,,,,,,,,,,,,,,,,,,,,,,,,,,,,,,,,,,,,,,,,,,,,,,,,,,,,,,,,,,,
DQjRfrPkmrF,👏👏👏👏👏,😍😍,👏👏,Fabulous 😍,This is beautiful,"Oh my! I adore the sea and dolphins! I am def stealing this creation - not to credit it as mine, evidently, but to admire it in my phone gallery 🤭",Yes feeling the ☀️☀️,Do you like the feeling of the sun on your skin after a good swim?,,,,,,,,,,,,,,,,,,,,,,,,,,,,,,,,,,,,,,,,,,,,,,,,,,,,,,,,,,,,,,,,,,,,,,,,,,,,,,,,,,,,,,,,,,,,,,,,,,,,,,,,,,,,,,,,,,,,,,,,,,,,,,,,,,,,,,,,,,,,,,,,,,,,,,,,,,,,,,,,,,,,,,
DScKTvjDD6e,❤️❤️❤️,❤️😻❤️,🎀🎀🎀🎀,🔥🔥🔥🔥🔥🔥🔥🔥,😍😍😍😍😍😍😍❤️❤️🔥🔥🔥,🎄🎄🎄🎄,🎅🎅🎅🎅,Waaaw fantastic 😍😍😍😍😍,Lindo🙌🙌🙌,Cuties 😍❤️😍❤️,Guten Morgen wünsche einen schönen Mittwoch ❤️❤️😆👏♥️🫂🫂🫂🫂🫂🫂🫂🫂🫂🫂🫂,"Wow, so sweet 🎄🐈🎄🐈🎄",,,,,,,,,,,,,,,,,,,,,,,,,,,,,,,,,,,,,,,,,,,,,,,,,,,,,,,,,,,,,,,,,,,,,,,,,,,,,,,,,,,,,,,,,,,,,,,,,,,,,,,,,,,,,,,,,,,,,,,,,,,,,,,,,,,,,,,,,,,,,,,,,,,,,,,,,,,,,,,,,,
DSlL18bDEhJ,So beautiful ❤️❤️❤️❤️,Sugárzóan gyönyörű!❤️🔥👏👏,I❤️ART,Beautiful ❤️,🔥🔥🔥❤️❤️❤️,Beautiful ❤️,❤️❤️😍😍🔥🔥👏👏,😍❤️❤️❤️,💯❤️,❤️🔥,❤️❤️❤️🔥🔥 Beautiful 👏👏👏✨️😍✨️🤗,😍😍😍😍,Great work Gabriella ✨,So so beautiful 😍😍❤️❤️,Stunning,Faz um desenho meu😍,❤️❤️❤️❤️❤️,🔥🔥🔥🔥🔥🔥🔥🔥👏🔥🔥❤️,😍😍😍😍😍❤️❤️❤️💐💐💐🌺🌺🌺🌺💖,❤️❤️🔥❤️❤️,Geweldig mooi😍,Stunning ❤️,😍😍😍😍😍😍😍😍😍🔥🔥❤️❤️,magnificent creation I love your works they are great 👏🏻😊😎,Amazingly beautiful ❤️❤️❤️❤️❤️❤️❤️❤️,👏,,,,,,,,,,,,,,,,,,,,,,,,,,,,,,,,,,,,,,,,,,,,,,,,,,,,,,,,,,,,,,,,,,,,,,,,,,,,,,,,,,,,,,,,,,,,,,,,,,,,,,,,,,,,,,,,,,,,,,,,,,,,,,,,,,,,,,,,,,,,,,,,,,,,
DRhZaJnASMQ,Amazing 😍,Mesmerizing ❤️,Wonderful,😍,Wow 🔥🔥,🔥🔥🔥incredible,Celestial witness,Wow I love how beautiful this sky is,🔥❤️🔥,🔥,😍😍😍,Wow😍,💯❤️,😍🔥,😍😍😍,❤️,What is the name of the song? 🇧🇷👏👏👏,I loved this Unreal Imagination of yourself to Create 😍this beautiful world,So cool😍👍🏻,👏👏👏👏,"Wow, it's so stunning. It's so beautiful to me",😍 brilliant,🙌,👏👏👏😍,❤️,❤️,❤️❤️,Beauty,,Infinite sukuyomi 😍,Nice,✨ This looks epic!!! 👻,😍😍🔥,🔥🔥🔥,❤️❤️❤️,🔥🔥,👏👏👏👏,❤️,Substantial. 👁️,🔥,😍🔥🔥,Beautiful Work 👏,Nice ❤️😍,🙌🔥,👏🔥,Absolutely beautiful and gorgeous 😍😍😍😍🥰🥰🥰🥰🥰🥰🥰🥰😮😮😮😮😮😮🤩🤩🤩🤩🤩🤩😘😘,Fantastic ❤️😊😊👍👍,Great,Nice,Cool,,,,,,,,,,,,,,,,,,,,,,,,,,,,,,,,,,,,,,,,,,,,,,,,,,,,,,,,,,,,,,,,,,,,,,,,,,,,,,,,,,,,,,,,,,,,,,,,,,,,,,,,,,,,,,,,,,,,,,,,,,,,
